DeptID,EntityName,PAN,RegisteredAddress,Contact
UDYAM-751837,Shree Industries Pvt tLd,EZYON7090N,"plot 700, peenya, delhi, dl",9372854425
UDYAM-175486,Pioneer Enterprises Pvt Ltd,NGNZA9073J,"plot 981, guindy, ahmedabad, gj",9748217534
UDYAM-220787,ApexC orp LLP,PBXIY9234B,"Plot 992, Peenya, Chennai, TN",9693938649
UDYAM-753074,ShreeL ogistics Pvt Ltd,HBFGG3657U,"Plot 784, MIDC, Ahmedabad, GJ",9608698103
UDYAM-242166,Tech Traders Limited,ZSBWG8545A,"Plot 417, Hitec City, Hyderabad, TS",9808792412
UDYAM-955679,Global Industries LLP,HFLII2018Z,"Plot 5, Phase 1, Electronic City, Chennai, TN",9429332606
UDYAM-747869,Global eTchnologies LLP,SXIOC1520E,"plot 868, peenya, hyderabad, ts",9140217827
UDYAM-725195,Dynamic Fabrication Lmiited,WDXFV0015C,"plot 522, midc, hyderabad, ts",9217304833
UDYAM-339847,Shree Logistics Limited,DOYKF9985H,"plot 93, ph 1, electronic city, bengaluru, ka",9995322828
UDYAM-444689,Apex Logistics Ptv Ltd,LAUDN4026Q,"Plot 350, Peenya, Hyderabad, TS",9114630888
UDYAM-198560,Acme Solutions LLP,MOIEF5566B,"Plot 881, Phase 1, Electronic City, Pune, MH",9266812871
UDYAM-462792,Metro Enterprisse LLP,HPXEU3116E,"plot 301, midc, hyderabad, ts",9110851844
UDYAM-254525,Stellar Fabrication Limited,AQGDE1532P,"Plot 68, GIDC, Ahmedabad, GJ",9871129684
UDYAM-562431,PioneerT echnologies Limited,WERBY0717L,"Plot 111, Okhla Ind Estate, Pune, MH",9670435339
UDYAM-464751,Pirme Ventures LLP,NEOHR1776Z,"plot 543, midc, delhi, dl",9343259975
UDYAM-992483,Stellar Enterprises Limited,PWOHW3090S,"Plot 786, Guindy, Ahmedabad, GJ",9817565347
UDYAM-629122,Stellar Industries LLP,OHNGO1139L,"Gala No. 61, Shady Complex, Pune, MH",800547700
UDYAM-479758,Global Cor pLimited,IVFYI5335H,"Plot 597, Okhla Ind Estate, Ahmedabad, GJ",9378168114
UDYAM-619813,Stellar Technoloiges Limited,SKKKI6313C,"plot 756, hitec city, delhi, dl",9755161705
UDYAM-336656,Om Corp Limited,EUNUF6383G,"plot 546, hitec city, bengaluru, ka",9249105724
UDYAM-385108,Sunrise Technologies LLP,PJXRD4610X,"plot 796, midc, pune, mh",9792016515
UDYAM-403631,Stellar Solutions Limited,EZSGZ9108K,"plot 815, peenya, bengaluru, ka",9696614366
UDYAM-898566,Pioneer Industries Limited,VJOFY5090W,"Plot 104, Hitec City, Hyderabad, TS",9167669537
UDYAM-347338,Om Industries Pvt Ltd,DMXSU0305G,"Plot 738, MIDC, Ahmedabad, GJ",9788263147
UDYAM-738537,Om Industries LLP,WBSEL7122C,"plot 12, gidc, mumbai, mh",9619962450
UDYAM-940339,Sunrise nIdustries Limited,RUYCM9355W,"Plot 59, Peenya, Ahmedabad, GJ",9635275336
UDYAM-644003,Sunrise Industries Pvt Ltd,KWYUA1925B,"plot 572, peenya, ahmedabad, gj",9380951945
UDYAM-845058,Shree Industries LLP,VPGSI5685B,"plot 781, midc, delhi, dl",9180370908
UDYAM-969167,Om Enterprises Limited,FNAMO5396E,"plot 373, midc, bengaluru, ka",9673118657
UDYAM-747046,Om Corp Pvt Ltd,IUKNI4774Y,"Plot 377, Okhla Ind Estate, Chennai, TN",9330623370
UDYAM-86935,DynamicT echnologies Pvt Ltd,RHMAV7311V,"Plot 536, GIDC, Chennai, TN",9626336699
UDYAM-815015,Apex Corp Limited,EOCNN0243R,"Plot 906, Peenya, Delhi, DL",9543390238
UDYAM-506233,Apex Fabrication LLP,JODGP9489V,"plot 465, peenya, bengaluru, ka",9699863421
UDYAM-392620,Metro Traedrs LLP,FELQM4913I,"plot 422, midc, ahmedabad, gj",9402089435
UDYAM-63193,Balaji Fabrication LLP,PPBSD4941U,"Plot 418, Hitec City, Bengaluru, KA",9454712424
UDYAM-97193,Sunrsie Corp LLP,DMWQO9323V,"plot 414, hitec city, pune, mh",9767071328
UDYAM-98320,Sunrise Traders Pvt Ltd,WXTID5197Z,"plot 251, gidc, mumbai, mh",9168579953
UDYAM-252712,Apex Enterprises LLP,GNCNL5575O,"plot 378, midc, mumbai, mh",9273300319
UDYAM-728273,Sunrise Ventures Pvt Ltd,CCGRK7067R,"plot 386, hitec city, hyderabad, ts",9108322838
UDYAM-897212,Om Technologies Limited,TVFZX3700C,"plot 386, hitec city, ahmedabad, gj",9317669717
UDYAM-225832,Pioneer Solutions LLP,UDCTD1668F,"plot 839, ph 1, electronic city, chennai, tn",9763949943
UDYAM-232459,Shree Farbication Pvt Ltd,PHYRJ3457Z,"Plot 62, MIDC, Ahmedabad, GJ",9924862532
UDYAM-602888,Sunrise Industries Limited,SACWL8716G,"plot 691, midc, ahmedabad, gj",9496666828
UDYAM-354216,Baljai Solutions Pvt Ltd,LMGRF8977K,"Plot 399, Peenya, Chennai, TN",9929873949
UDYAM-835162,Sunrise Enterpriess LLP,CDZLE0611R,"plot 636, peenya, ahmedabad, gj",9805403676
UDYAM-39656,Tech Corp Limited,PWGEE7944G,"Plot 210, Okhla Ind Estate, Ahmedabad, GJ",9163580217
UDYAM-63624,Prime Logistics Limited,KNQVD2040U,"Plot 810, Guindy, Ahmedabad, GJ",9815870873
UDYAM-572954,Apex Technologies Limited,HSWCM2507K,"plot 428, midc, ahmedabad, gj",9943269850
UDYAM-382105,Stellar eVntures LLP,UIHBX9315K,"Plot 559, Phase 1, Electronic City, Mumbai, MH",9364936975
UDYAM-968225,Global Logistics Limited,EGLSY0104F,"Plot 680, Phase 1, Electronic City, Delhi, DL",9712142948
UDYAM-173199,Pioneer Fabricatio nLLP,VQCZS2910G,"plot 899, peenya, hyderabad, ts",9730293858
UDYAM-99567,Stellar Traders Pvt Ltd,IFWPS0250Y,"plot 529, midc, ahmedabad, gj",9202823274
UDYAM-539426,Shree Logistics LLP,INLWZ3502S,"plot 270, gidc, delhi, dl",9310309288
UDYAM-819701,Tech oCrp Limited,IVAHN9922R,"plot 388, gidc, ahmedabad, gj",9358407487
UDYAM-510342,Om Industries Pvt Ltd,VVDFM9144G,"Plot 743, Hitec City, Hyderabad, TS",9809225457
UDYAM-961333,Balaji Enterprises LLP,TGXYG5828U,"plot 472, midc, hyderabad, ts",9694745174
UDYAM-919583,Metro Tradres LLP,LYXJL8225M,"plot 382, midc, pune, mh",9596121371
UDYAM-613516,Balaji Traders Pvt Ltd,VJRHI6121P,"plot 205, ph 1, electronic city, hyderabad, ts",9623593279
UDYAM-860846,Prime Logistics Pv tLtd,TLBAE5664S,"plot 39, guindy, mumbai, mh",9187203728
UDYAM-593018,Sunrise Traders Limited,LGCSA2499D,"plot 871, ph 1, electronic city, ahmedabad, gj",9483735669
UDYAM-802368,Prime Industrie sLLP,UODVO3980R,"Plot 288, Hitec City, Bengaluru, KA",9720421518
UDYAM-720611,Shree Industries LLP,VQISF1602A,"Plot 147, Okhla Ind Estate, Hyderabad, TS",9425546469
UDYAM-209778,Acme Technologies Pvt Ltd,XATQW1815D,"plot 795, guindy, chennai, tn",9299994202
UDYAM-339530,Pioneer Corp Pvt Ldt,FWJKD4946K,"plot 826, midc, delhi, dl",9894658685
UDYAM-206441,Pioneer Corp Pvt Ltd,JHTHR6090B,"Plot 311, Phase 1, Electronic City, Delhi, DL",9882733259
UDYAM-626912,Apex Logisitcs LLP,XABCC9964A,"plot 107, hitec city, chennai, tn",9815746157
UDYAM-22420,Dynamic Industreis Pvt Ltd,RCYIH8648O,"plot 955, hitec city, delhi, dl",9937268483
UDYAM-635964,Dynamic Enterprises Pvt Ltd,SNMGT3555A,"plot 689, guindy, pune, mh",9794767973
UDYAM-481183,StellarC orp LLP,AYVNH6273H,"plot 984, okhla ind est, hyderabad, ts",9351763504
UDYAM-381723,Stella rFabrication Limited,UWXZG8131B,"plot 210, ph 1, electronic city, hyderabad, ts",9742126866
UDYAM-87551,Prime Technologies Limited,YPULT0467S,"Plot 431, Okhla Ind Estate, Delhi, DL",9575369502
UDYAM-984838,Apex Technologie sPvt Ltd,ABVDZ7159H,"plot 401, ph 1, electronic city, mumbai, mh",9759624092
UDYAM-33129,Dynamic Industries Pvt Ltd,NCHZR5344S,"Gala No. 90, Shady Complex, Delhi, DL",800934779
UDYAM-604006,Stellar Industires Pvt Ltd,WJBTP3226O,"plot 535, midc, hyderabad, ts",9217171578
UDYAM-477925,Stellar Technologies Pvt Ltd,RBPOS8114T,"plot 190, okhla ind est, mumbai, mh",9495500817
UDYAM-524136,Tech Tehcnologies Limited,HPBZP7088K,"plot 705, guindy, ahmedabad, gj",9929410971
UDYAM-324244,Dynamic Trader sPvt Ltd,CZCVB3492B,"Plot 597, Hitec City, Delhi, DL",9316964813
UDYAM-765133,Tech Logistisc LLP,FCYYJ9793O,"plot 455, peenya, hyderabad, ts",9724694009
UDYAM-939569,Metro Ventures Pvt Ltd,XMYSF5122Y,"gala no. 6, shady complex, pune, mh",800404319
UDYAM-272232,Metro Fabrication Pv tLtd,YEOXI8241X,"plot 459, hitec city, pune, mh",9323161578
UDYAM-456972,Apex Solutions Pvt Ltd,EDQUL0164H,"plot 84, peenya, hyderabad, ts",9588436465
UDYAM-46763,Apex Solutions Limited,XTUHK7842M,"plot 540, midc, pune, mh",9775647169
UDYAM-911691,Shree Traders Limited,KFEBR3313D,"Plot 423, Peenya, Bengaluru, KA",9875512045
UDYAM-86945,Prime Solutions Pvt Ltd,RELPS8513B,"Plot 227, Okhla Ind Estate, Ahmedabad, GJ",9268643787
UDYAM-465402,Metro Fabrication Limited,SPNFE1143Y,"Gala No. 16, Shady Complex, Hyderabad, TS",800235888
UDYAM-972531,Apex Industries Limited,XZZGK6281U,"plot 930, ph 1, electronic city, pune, mh",9199421084
UDYAM-546581,Sunrise Ventures LLP,OPVSF6493Q,"plot 520, ph 1, electronic city, delhi, dl",9660109847
UDYAM-90654,Tech Fabrication Limtied,FPWWC1091P,"plot 503, gidc, mumbai, mh",9417847672
UDYAM-306221,Acme Vetnures LLP,UCTXF9369E,"plot 828, okhla ind est, ahmedabad, gj",9677728421
UDYAM-985959,Balaji Technologise LLP,MQLKS0284H,"Plot 59, MIDC, Delhi, DL",9579843470
UDYAM-468883,Balaji Ventuers LLP,DMYBW9766Y,"plot 976, gidc, hyderabad, ts",9514136959
UDYAM-912361,Stelalr Industries Pvt Ltd,KRDQX4638M,"Plot 310, Phase 1, Electronic City, Bengaluru, KA",9887663043
UDYAM-851290,Shree Technologies Pvt Ltd,DCKWS2158Y,"plot 821, okhla ind est, pune, mh",9522935359
UDYAM-589709,Apex Corp Pvt Ltd,VVPHE4968E,"plot 487, midc, hyderabad, ts",9360638513
UDYAM-843522,Stellar Corp Pvt Ltd,IHJTB9817V,"plot 90, hitec city, ahmedabad, gj",9466350642
UDYAM-988395,Metro IndustriesL LP,WGUKY5376V,"plot 284, peenya, chennai, tn",9250475121
UDYAM-895027,Metro Logistics Pvt Ltd,BZYLS7110L,"Plot 136, Hitec City, Hyderabad, TS",9829487432
UDYAM-627543,Sunrise Logistics Pvt Ltd,QVMQU1113N,"Plot 338, Hitec City, Bengaluru, KA",9252448429
UDYAM-259763,Metro Solutions Limited,IIDMO7834P,"Plot 198, MIDC, Pune, MH",9184942229
UDYAM-428308,Global Indsutries LLP,KABTR2995J,"Plot 294, GIDC, Ahmedabad, GJ",9168373120
UDYAM-47323,Apex Fabricatio nPvt Ltd,UVXRE6135K,"Plot 915, Okhla Ind Estate, Pune, MH",9376765118
UDYAM-185187,Aepx Logistics Pvt Ltd,LAXPV0511T,"Plot 995, GIDC, Bengaluru, KA",9735713492
UDYAM-269330,Sunrise Industries Limited,HHDAF7595Z,"plot 892, guindy, hyderabad, ts",9310770376
UDYAM-467603,Pinoeer Corp LLP,ELVZU9153R,"Plot 837, Okhla Ind Estate, Bengaluru, KA",9985917318
UDYAM-708981,Shree Traders Limited,ASULS7197Z,"plot 213, ph 1, electronic city, ahmedabad, gj",9899921612
UDYAM-819254,Global Soltuions LLP,DOGIX3716O,"Plot 439, Okhla Ind Estate, Delhi, DL",9380625733
UDYAM-191366,Acem Traders Limited,PLDXK7448V,"plot 904, ph 1, electronic city, mumbai, mh",9991466971
UDYAM-939190,Metro Logistics Limited,JBOKH7231I,"plot 953, ph 1, electronic city, ahmedabad, gj",9868687910
UDYAM-460615,Om Traders LLP,ALGFW1930M,"plot 737, hitec city, pune, mh",9715505559
UDYAM-211421,Sunrise Industries Pvt Ltd,AGPRU3897U,"plot 651, gidc, hyderabad, ts",9478358292
UDYAM-886829,Acme Logistcis Limited,MYDSJ6630D,"Plot 436, Hitec City, Chennai, TN",9300237768
UDYAM-200844,Golbal Corp Pvt Ltd,ATZZA7970O,"Plot 538, Phase 1, Electronic City, Hyderabad, TS",9287300806
UDYAM-183641,Glboal Industries LLP,QMIEW1226L,"Plot 449, Peenya, Delhi, DL",9606346271
UDYAM-106849,Ape xTechnologies Pvt Ltd,CVQJH6853K,"Plot 324, Okhla Ind Estate, Delhi, DL",9154074263
UDYAM-815452,Metro Enterprises Limited,QJRTW2907F,"plot 58, gidc, hyderabad, ts",9369668387
UDYAM-299685,Apex Enterprises Limited,YANWN9704Z,"Plot 184, MIDC, Bengaluru, KA",9307822594
UDYAM-732619,Sunrise Entreprises LLP,HHKUL2877N,"Plot 420, Peenya, Delhi, DL",9891885785
UDYAM-256285,Shree Fabrication Pvt Ldt,DALEY2989B,"plot 119, midc, pune, mh",9171055954
UDYAM-738650,Sunrise Traders LLP,OVVNY5525T,"Plot 49, Peenya, Mumbai, MH",9919895743
UDYAM-438713,Sunrise Solutions Pvt Ltd,ONQGP1909X,"plot 911, okhla ind est, mumbai, mh",9874030486
UDYAM-571829,Sunrise Fabrication Limited,GQEDH9805X,"plot 956, hitec city, hyderabad, ts",9504537695
UDYAM-582525,Om Ventures Limited,HAJEG3792T,"plot 596, midc, chennai, tn",9923296045
UDYAM-913229,Stellar Loigstics LLP,UZVGB3435S,"Plot 186, Okhla Ind Estate, Chennai, TN",9358242893
UDYAM-451277,Acme Soltuions LLP,GQULH6683K,"plot 341, guindy, mumbai, mh",9587588614
UDYAM-921218,Metro Technologies Limited,CCOQX4778U,"Plot 169, Okhla Ind Estate, Chennai, TN",9261818776
UDYAM-287393,Shree Solutions Limited,WHFCL7028Z,"plot 253, gidc, pune, mh",9155729551
UDYAM-598393,PioneerC orp Pvt Ltd,LPHXY4123X,"Plot 639, Peenya, Delhi, DL",9754987045
UDYAM-810209,Om Traders LLP,VXULT5274E,"Plot 890, Okhla Ind Estate, Bengaluru, KA",9762877506
UDYAM-621831,Apex CorpL imited,EMHFP6844Z,"plot 301, midc, pune, mh",9884201726
UDYAM-883401,Om Enterprise sLLP,OUOBD9435M,"Plot 759, Okhla Ind Estate, Bengaluru, KA",9655783508
UDYAM-860384,Prime Ventures Limited,WHAWS7637M,"plot 738, hitec city, ahmedabad, gj",9306914303
UDYAM-602299,Apex Logistics LLP,JLEUJ8112Z,"plot 879, midc, chennai, tn",9128390155
UDYAM-965672,Stella rCorp LLP,RZJTB4165W,"plot 64, okhla ind est, bengaluru, ka",9844467154
UDYAM-380525,Pionere Enterprises Limited,BHUWS5989G,"Plot 609, Hitec City, Pune, MH",9853828280
UDYAM-373537,Sunrise Solutions Pvt Ltd,XTRYH3935D,"plot 535, gidc, bengaluru, ka",9357799395
UDYAM-862440,Pioneer Technologies Limited,ZUCSP7422B,"plot 217, midc, hyderabad, ts",9831158228
UDYAM-226131,Global Solutions Limited,YDXUK2749I,"Plot 860, GIDC, Bengaluru, KA",9168761636
UDYAM-476828,Shree Enterprises iLmited,XPSSG7990S,"plot 767, gidc, bengaluru, ka",9655892330
UDYAM-829074,Acem Fabrication Pvt Ltd,BTAZN4822F,"plot 680, ph 1, electronic city, hyderabad, ts",9954620217
UDYAM-718514,Tech Enterprises Pvt Ltd,KZMEY3661D,"Plot 733, Guindy, Delhi, DL",9335616874
UDYAM-558519,Sunrise Traders Pvt Ltd,ELIGC0820N,"Plot 902, Hitec City, Delhi, DL",9313043555
UDYAM-964306,Global Corp Pvt Ltd,ZSNRQ4998M,"Plot 108, MIDC, Pune, MH",9222757985
UDYAM-239012,Shree Industries LLP,XDDDO7698U,"plot 449, peenya, ahmedabad, gj",9238382334
UDYAM-221509,Tech Fabrication Limited,NBMZL0339M,"Plot 753, Okhla Ind Estate, Delhi, DL",9966163826
UDYAM-290220,Prime Etnerprises LLP,ZHLWZ9457W,"Plot 553, Peenya, Delhi, DL",9891393425
UDYAM-664363,Global Solutions Pvt Ltd,YPUZM6110V,"Plot 302, Hitec City, Bengaluru, KA",9118351836
UDYAM-309613,Shree Technologies Limitde,OKSFG8563A,"Plot 849, Phase 1, Electronic City, Ahmedabad, GJ",9747191827
UDYAM-651760,Metro Logistics LLP,VDHZM4533O,"Plot 462, MIDC, Hyderabad, TS",9665083633
UDYAM-469748,Om Logistics Pvt Ltd,UARAX3448T,"Plot 871, Peenya, Chennai, TN",9958832324
UDYAM-216571,StellarV entures Pvt Ltd,QDBNT4535J,"plot 323, okhla ind est, bengaluru, ka",9705321391
UDYAM-700124,Globa lTraders Pvt Ltd,LCOHL5871Q,"plot 992, gidc, chennai, tn",9980576912
UDYAM-970238,Sunrise Solutions Pvt Ltd,AQOOP3988N,"plot 92, ph 1, electronic city, pune, mh",9614736960
UDYAM-918344,Stellar Industries Pvt Ltd,HFIFH4514S,"Plot 609, Peenya, Ahmedabad, GJ",9798239365
UDYAM-554981,Dynamic Fabricatio nLimited,ZPBCW2772K,"Plot 932, Phase 1, Electronic City, Hyderabad, TS",9474592943
UDYAM-289780,Global Ventures Pvt Ltd,CSPDC9757F,"Plot 872, GIDC, Hyderabad, TS",9225777138
UDYAM-430396,Tech Logistics Limited,WZEGS4195F,"Plot 582, Peenya, Bengaluru, KA",9563671526
UDYAM-251934,Global Soltuions Pvt Ltd,IOINU4951I,"plot 722, peenya, delhi, dl",9266614402
UDYAM-603366,Acme Ventures Pvt Ltd,RALJG2992K,"Plot 988, MIDC, Ahmedabad, GJ",9244251821
UDYAM-290812,Tech Corp Pvt Ltd,SQRTL3507C,"Plot 366, Phase 1, Electronic City, Mumbai, MH",9134363005
UDYAM-151058,Metro Traders Pvt Ltd,UUZSG1764H,"Plot 921, Hitec City, Chennai, TN",9420253265
UDYAM-304559,Global Traders Pvt Ltd,KBVZV5652Y,"Plot 453, Okhla Ind Estate, Ahmedabad, GJ",9730482502
UDYAM-666050,Metro Solutions LLP,KRVGP6566L,"Plot 502, Okhla Ind Estate, Mumbai, MH",9777723465
UDYAM-146193,Apex Solutions Limited,UPHMI4375C,"gala no. 57, shady complex, mumbai, mh",800413627
UDYAM-351536,Dynamic Technologies Pvt Ltd,CERZV1946B,"Gala No. 58, Shady Complex, Bengaluru, KA",800878568
UDYAM-190592,Metro Corp LLP,OWOLW2389U,"plot 740, peenya, pune, mh",9958859201
UDYAM-355840,Global eVntures Pvt Ltd,HKYJG5287D,"Plot 265, Guindy, Bengaluru, KA",9356270019
UDYAM-115155,Prime Industries Limited,KIMNI3750O,"plot 784, peenya, delhi, dl",9980220183
UDYAM-408984,Apex Fabrication Pvt Ltd,XLZOL0524Y,"Plot 108, Hitec City, Pune, MH",9891172331
UDYAM-284355,Shree Industries LLP,GKBWO7941I,"Plot 975, Hitec City, Delhi, DL",9745139489
UDYAM-187895,BalajiF abrication Pvt Ltd,HLGOQ5989F,"Plot 232, Peenya, Hyderabad, TS",9512324025
UDYAM-621402,Apex Corp Ptv Ltd,MNWGT3463U,"Plot 967, Guindy, Delhi, DL",9969528882
UDYAM-930376,Prime Corp LPL,SKYVC9767J,"Plot 783, Hitec City, Ahmedabad, GJ",9210207110
UDYAM-646124,Tech Technologies Pvt Ltd,NVSOX4431X,"Plot 433, Peenya, Chennai, TN",9112189149
UDYAM-746328,Pioneer Logistics Limited,RLZPH4032H,"plot 553, hitec city, chennai, tn",9113884813
UDYAM-68359,Stellar Ventures Limited,VXKLN9775T,"plot 902, gidc, bengaluru, ka",9254977751
UDYAM-348521,Apex Industries LLP,RYPZG5438D,"Plot 235, Okhla Ind Estate, Delhi, DL",9483197467
UDYAM-601348,Global Industires Limited,ECWOB4409Z,"plot 233, midc, bengaluru, ka",9893899852
UDYAM-704507,Tceh Technologies Limited,JYAJR2918N,"Plot 383, Hitec City, Ahmedabad, GJ",9356627543
UDYAM-587184,Global Solutions Pvt Ltd,DWFMG5324X,"Plot 294, Phase 1, Electronic City, Delhi, DL",9901850816
UDYAM-101896,Sunrise Logistics Pvt Ltd,KRDWO1965J,"Plot 624, Peenya, Ahmedabad, GJ",9801301110
UDYAM-43459,Stellar Corp LLP,ACQSQ3840E,"Plot 275, Guindy, Hyderabad, TS",9192395371
UDYAM-945585,Sunrise Ventures Pvt Ltd,QJJKW9635M,"plot 129, okhla ind est, chennai, tn",9227944869
UDYAM-201743,Sunrise Solutions PvtL td,ZROID1023U,"plot 903, hitec city, hyderabad, ts",9481515571
UDYAM-683481,Dynamic Corp LLP,ANQOJ6890E,"Plot 596, Okhla Ind Estate, Ahmedabad, GJ",9471322946
UDYAM-253008,Apex Soltuions Limited,WYMSO2591R,"plot 97, peenya, mumbai, mh",9396802514
UDYAM-857175,Dynamic Traders Limited,RGYWT9242Y,"Plot 773, Guindy, Pune, MH",9446904677
UDYAM-460270,Balaji Corp LLP,EFIEA2453Q,"Plot 235, MIDC, Chennai, TN",9972673115
UDYAM-132718,Tech Corp LLP,ACPXE4252Q,"Plot 772, MIDC, Chennai, TN",9452193794
UDYAM-560967,Pioneer Ventures Limited,TDRJI4878K,"plot 391, guindy, mumbai, mh",9415059619
UDYAM-591154,ApexC orp Pvt Ltd,ZXYPT0341Y,"plot 520, gidc, pune, mh",9839366262
UDYAM-328567,Dynamic Enterprises LLP,MVQNC1992Q,"plot 56, hitec city, hyderabad, ts",9483210082
UDYAM-583351,Prime Traders LLP,QHPCK9235A,"Plot 673, Okhla Ind Estate, Delhi, DL",9864723388
UDYAM-173452,Balaji Enterprises Limited,XLYFO4907B,"plot 972, ph 1, electronic city, pune, mh",9137353392
UDYAM-13860,Global Corp Pvt Ltd,HKSWP0359N,"Plot 251, MIDC, Pune, MH",9922127727
UDYAM-692311,Prime Fabrication LLP,RSTFM4020D,"plot 462, guindy, ahmedabad, gj",9103832819
UDYAM-995883,Acme Corp Pvt Ltd,PHAWY5918A,"plot 693, ph 1, electronic city, pune, mh",9470369913
UDYAM-393288,Apex Corp Pvt Ltd,WDXHN9530G,"Plot 340, GIDC, Mumbai, MH",9625000333
UDYAM-133878,Prime Indutsries LLP,EPDAU5240I,"Plot 409, Okhla Ind Estate, Mumbai, MH",9242389915
UDYAM-175645,Sunrise Corp LLP,MJZHX0326P,"Plot 320, MIDC, Mumbai, MH",9306726510
UDYAM-85212,Balaji Corp Pvt Ltd,MKPUP4773P,"Plot 45, Okhla Ind Estate, Hyderabad, TS",9711372162
UDYAM-635637,Shree Traders LLP,EUBLV5656S,"plot 683, gidc, bengaluru, ka",9185647694
UDYAM-794792,Apex Corp Limited,HXWBL7313N,"plot 154, midc, hyderabad, ts",9329848492
UDYAM-898554,Sunrise TradersP vt Ltd,VJFSE1291Q,"Plot 506, GIDC, Pune, MH",9564062676
UDYAM-754666,Pioneer Solutions LLP,FRSNE3700N,"plot 436, ph 1, electronic city, mumbai, mh",9490148086
UDYAM-236977,Acme Technloogies LLP,DTRJG4778Z,"plot 125, midc, bengaluru, ka",9177143564
UDYAM-141782,Stellar Industries LLP,XTTLA2664U,"plot 528, guindy, chennai, tn",9731669880
UDYAM-236083,Prime Corp Limited,WHEJB1497G,"Plot 389, MIDC, Pune, MH",9231259931
UDYAM-689603,Global Sloutions LLP,DKBHM2981A,"plot 527, peenya, chennai, tn",9721608442
UDYAM-94516,Balaji Vnetures Pvt Ltd,ZUQQX4216B,"plot 395, gidc, delhi, dl",9947653003
UDYAM-516836,Stellra Fabrication LLP,BBBCN4668O,"Plot 966, Guindy, Bengaluru, KA",9398936353
UDYAM-287478,Dynamic Corp LLP,QVDBD8601C,"plot 644, midc, delhi, dl",9597096194
UDYAM-526144,Balaji Ventures Pvt Ltd,DDBLW7101R,"Plot 796, Phase 1, Electronic City, Mumbai, MH",9870712905
UDYAM-427347,Stellar Logistics Pv tLtd,IWWSR7031D,"plot 369, hitec city, bengaluru, ka",9649228600
UDYAM-150847,Balaji Fabrication Pvt Ltd,WPRJO7291M,"plot 249, okhla ind est, chennai, tn",9242620584
UDYAM-94790,Tech Industries Pvt Ldt,RPHYD9009U,"plot 886, ph 1, electronic city, ahmedabad, gj",9941948469
UDYAM-780719,Stellar Industries LLP,GBIQN6901Z,"plot 729, gidc, ahmedabad, gj",9390060341
UDYAM-900940,Metro Technologies Limited,MYWBG3340J,"Plot 333, Guindy, Ahmedabad, GJ",9621942292
UDYAM-391155,Sunrise Traders Limited,EFYKW4014S,"Plot 610, Guindy, Pune, MH",9800437176
UDYAM-191516,Balaji Industries LPL,ITQLO5922F,"gala no. 69, shady complex, chennai, tn",800724423
UDYAM-894220,Apex Industries Limtied,QPVPR0986V,"plot 718, ph 1, electronic city, mumbai, mh",9247922265
UDYAM-445470,Balaji Indsutries Pvt Ltd,USXXJ0965N,"Plot 903, Peenya, Delhi, DL",9170480072
UDYAM-248417,Setllar Traders Limited,ZHXXL2718O,"Plot 898, MIDC, Bengaluru, KA",9895393619
UDYAM-372008,Apex Industries Limited,CPJHN7652N,"Plot 515, Phase 1, Electronic City, Chennai, TN",9469766050
UDYAM-146172,Sunrise Traders LLP,RUYOH2141V,"plot 282, okhla ind est, pune, mh",9671035266
UDYAM-702369,Mtero Industries LLP,BNXAQ8553Z,"Plot 632, Guindy, Ahmedabad, GJ",9729601815
UDYAM-963394,Stellar Industries Pvt Ltd,MGMPQ7517I,"Plot 739, Peenya, Pune, MH",9460108562
UDYAM-614653,Shree Enterprises LLP,MCNHG9547R,"Plot 456, Okhla Ind Estate, Ahmedabad, GJ",9199973798
UDYAM-561642,Acme Sloutions Limited,KYRED5133H,"plot 755, midc, ahmedabad, gj",9673719172
UDYAM-624700,Acm eEnterprises Limited,ZVUOQ3052U,"Plot 286, Guindy, Chennai, TN",9150352204
UDYAM-753613,Acem Logistics Limited,IOKUP4503S,"Plot 880, GIDC, Ahmedabad, GJ",9726883026
UDYAM-798272,Balaji Enterprises LLP,LYLZP5300S,"Plot 812, MIDC, Bengaluru, KA",9871821388
UDYAM-881791,Shree Industries LLP,PUHPY0534A,"Plot 90, Okhla Ind Estate, Chennai, TN",9999508377
UDYAM-26477,Shree Industreis LLP,GRPHI9809Z,"Plot 260, Peenya, Bengaluru, KA",9213170702
UDYAM-890656,Sunrise FabricationP vt Ltd,VAERL3240T,"plot 323, peenya, chennai, tn",9791549930
UDYAM-850206,Dynamic Fabrication Liimted,JKHVK8914N,"Plot 793, GIDC, Bengaluru, KA",9187515625
UDYAM-367911,Shree Technologie sLLP,TAFZT1318K,"plot 702, gidc, ahmedabad, gj",9903723893
UDYAM-963126,Global Fabrication Limited,LZWZU5078X,"plot 149, hitec city, delhi, dl",9375023690
UDYAM-989291,Stellar Industries Limited,UCPEA9050D,"plot 163, hitec city, bengaluru, ka",9739728270
UDYAM-515932,Balaji Corp LLP,MLNSP1408V,"plot 641, midc, chennai, tn",9172550815
UDYAM-327996,Tech Solutions Limited,UXJUC7582D,"plot 916, guindy, pune, mh",9787686749
UDYAM-37698,Dynamic Enterprises Pvt Ltd,WGVBX8522F,"Plot 15, Okhla Ind Estate, Chennai, TN",9938455667
UDYAM-630997,Om Ventures Limited,CNDUH1712D,"Plot 225, Guindy, Ahmedabad, GJ",9362664905
UDYAM-808984,Metro Logistics Limited,KOEBJ6094P,"Plot 513, Guindy, Pune, MH",9983733504
UDYAM-457703,Sunrsie Logistics LLP,QENSG6525A,"plot 391, midc, bengaluru, ka",9519790840
UDYAM-120310,Globa lIndustries LLP,TRHZY8288L,"plot 220, gidc, ahmedabad, gj",9916719558
UDYAM-326990,Ape xTechnologies Pvt Ltd,JZUNZ6038A,"plot 860, okhla ind est, delhi, dl",9185951473
UDYAM-704750,Pioneer Traders Pvt Ltd,BAKAO6247S,"plot 308, okhla ind est, mumbai, mh",9117140471
UDYAM-208306,Global Logistics Pvt Ltd,BOSVP6634O,"plot 383, peenya, delhi, dl",9244472813
UDYAM-621428,Pioneer Traders Pvt Ltd,YDRCM4342N,"plot 874, ph 1, electronic city, mumbai, mh",9986293535
UDYAM-531009,Metro Vetnures LLP,HYHJO4792W,"Plot 355, Okhla Ind Estate, Mumbai, MH",9251546692
UDYAM-609215,Global Crop LLP,HIDPX6555Y,"plot 268, hitec city, delhi, dl",9590301336
UDYAM-175037,Glboal Corp Limited,ODTHO8927W,"Gala No. 24, Shady Complex, Hyderabad, TS",800430565
UDYAM-903396,Metro Technologies LLP,KMXLH8694F,"plot 84, midc, hyderabad, ts",9198145791
UDYAM-807051,Dynamic Logistics LLP,BNCNP8045H,"Plot 543, Phase 1, Electronic City, Hyderabad, TS",9709010393
UDYAM-388126,Om Technologies Pvt Ltd,AQEZN1770K,"Plot 54, Peenya, Mumbai, MH",9256952108
UDYAM-360369,Prime Solutions Pvt Ltd,ADQOO5185E,"plot 733, guindy, pune, mh",9979513290
UDYAM-972235,Prime Technologies Pvt Ltd,RXERT8516D,"Plot 292, Hitec City, Hyderabad, TS",9759793495
UDYAM-934012,Om Logistics LLP,VVHPE0039Q,"plot 101, guindy, pune, mh",9453600165
UDYAM-779135,Acme Corp LLP,SVEXC2800H,"Plot 450, MIDC, Delhi, DL",9117465202
UDYAM-535327,Metro Logitsics Pvt Ltd,WOORL4373F,"plot 426, ph 1, electronic city, ahmedabad, gj",9838611495
UDYAM-147144,Prmie Solutions Pvt Ltd,XYXWX1895O,"plot 648, gidc, pune, mh",9318150571
UDYAM-726954,Global Industries Limited,EWVXD1232H,"Plot 260, Peenya, Pune, MH",9782808628
UDYAM-424970,Om Copr LLP,GHHUW8355N,"plot 914, gidc, mumbai, mh",9475212235
UDYAM-69852,Pioneer Fabrication LLP,AFURW9115V,"plot 185, ph 1, electronic city, mumbai, mh",9534543879
UDYAM-517860,Dynamic Solutions Pvt Ltd,AQTFX8805J,"plot 702, midc, pune, mh",9246440967
UDYAM-693067,Prime Loigstics LLP,KGEXG8797R,"Plot 252, Okhla Ind Estate, Delhi, DL",9348940077
UDYAM-713307,Apex Technologies Pvt tLd,PAYQS4427X,"plot 787, guindy, ahmedabad, gj",9438230537
UDYAM-864895,Tech Solutions Limited,MNZFK7783T,"Plot 430, Peenya, Mumbai, MH",9996003842
UDYAM-305713,Stelalr Ventures Limited,SZXKZ2527R,"Plot 334, Hitec City, Ahmedabad, GJ",9568016217
UDYAM-15997,Pioneer Industries Pvt Ltd,VEGMY3153Y,"Plot 574, Guindy, Bengaluru, KA",9343277103
UDYAM-100429,Global Technoloiges Limited,KBRWB2874Z,"Plot 43, Phase 1, Electronic City, Chennai, TN",9250925116
UDYAM-235867,Balaji Technologies LLP,JBWEK7615P,"Plot 254, GIDC, Delhi, DL",9611373384
UDYAM-209661,Shree Logistics iLmited,JZPKF0445D,"plot 538, guindy, hyderabad, ts",9479509665
UDYAM-864315,Balaji Traders Pvt Ltd,CPNJA7969O,"plot 710, peenya, delhi, dl",9444092397
UDYAM-248072,Stellar Traders LPL,HPKER7184M,"Plot 623, Peenya, Delhi, DL",9655978654
UDYAM-950547,Dynamic Technologies Pvt Ltd,TCZVV8959Y,"Plot 364, Guindy, Mumbai, MH",9922259460
UDYAM-937181,Sunrise Fabrication Pvt Ltd,NSQVK7062L,"plot 541, guindy, ahmedabad, gj",9460966930
