DeptID,EntityName,PAN,RegisteredAddress,Contact
UDYAM-112913,Dynamic Logisitcs LLP,ZPAHL7316Y,"Plot 106, Hitec City, Pune, MH",9732331898
UDYAM-440342,Balaji Enterprises LLP,EPSTK7191D,"Plot 902, Okhla Ind Estate, Delhi, DL",9995956199
UDYAM-158152,Stellar Industries LLP,LRWVY8513I,"Plot 779, Guindy, Delhi, DL",9899193825
UDYAM-104108,Sunrise Logisitcs LLP,AKMGN5472I,"plot 190, ph 1, electronic city, bengaluru, ka",9746942188
UDYAM-576473,Acme Solutions LLP,MGPHZ1900W,"plot 696, hitec city, chennai, tn",9320148891
UDYAM-938374,Dynamic Technologies Limited,XBKDS7737U,"plot 955, guindy, chennai, tn",9211213889
UDYAM-152125,Sunrise Industries Pvt Ltd,IZNYD7690S,"Plot 63, Okhla Ind Estate, Hyderabad, TS",9814287227
UDYAM-626213,Prime Inudstries LLP,JPLAV1852B,"plot 408, okhla ind est, mumbai, mh",9449366700
UDYAM-760537,Sunrise Corp Pvt Ltd,TXGYQ1831R,"plot 851, ph 1, electronic city, mumbai, mh",9448513518
UDYAM-273949,Dynamic Corp Limited,KSDBR7026M,"plot 865, ph 1, electronic city, hyderabad, ts",9695266802
UDYAM-702274,Prime Technologies LLP,LEVDO6600W,"plot 737, midc, bengaluru, ka",9398668779
UDYAM-627378,Global oLgistics Limited,NZPNP2916N,"Plot 651, Phase 1, Electronic City, Hyderabad, TS",9964275535
UDYAM-592012,Apex Industrie sLimited,RCQSB5499C,"Plot 112, Hitec City, Delhi, DL",9961034195
UDYAM-498432,Om Solutions Limitde,SLPKW0104P,"plot 781, ph 1, electronic city, mumbai, mh",9737311371
UDYAM-839671,Apex Enterprises Pvt Ltd,KFPXA8714N,"Plot 856, Hitec City, Ahmedabad, GJ",9412908381
UDYAM-402673,Sunrise Technologies Limited,JVOYR1977G,"plot 666, gidc, mumbai, mh",9748076949
UDYAM-821747,Baljai Fabrication LLP,MEKMU9325O,"Plot 573, Guindy, Chennai, TN",9475904349
UDYAM-252884,Stellar Enterprises LLP,ZOYJO5902V,"plot 781, peenya, pune, mh",9825897912
UDYAM-478402,Om Industries LLP,PIBPI6523D,"plot 50, gidc, chennai, tn",9291885554
UDYAM-827762,Dynamic Traedrs Limited,OBYYK5859B,"Plot 129, Hitec City, Ahmedabad, GJ",9345731336
UDYAM-272084,Tech Technologies Limited,SFXZO5427P,"plot 57, gidc, chennai, tn",9282206078
UDYAM-786340,Apex Traders Limietd,PWIDD4170O,"plot 46, hitec city, mumbai, mh",9304929319
UDYAM-720988,Dynamic Fabrication Ptv Ltd,YTEBW2780J,"plot 474, peenya, hyderabad, ts",9861424285
UDYAM-919424,Sunrise Solutions LLP,DPSLS6684A,"plot 755, okhla ind est, pune, mh",9571258285
UDYAM-633750,Om Crop LLP,SLHLS4874I,"plot 209, guindy, hyderabad, ts",9416580044
UDYAM-517370,Pioneer Corp Limited,TYESX6526J,"Plot 650, GIDC, Bengaluru, KA",9193873162
UDYAM-698225,Pioneer Corp LLP,CJZSJ8359T,"plot 209, gidc, ahmedabad, gj",9388944781
UDYAM-452076,Sunrise Corp Pvt Ltd,PSAGS6101C,"plot 707, gidc, chennai, tn",9538126413
UDYAM-232610,Balaji Enterprises Pvt Ltd,VHYSR6350H,"plot 284, hitec city, pune, mh",9480448687
UDYAM-470388,Balaji Solutions Pvt Ltd,ECUJS4847W,"plot 903, gidc, mumbai, mh",9668423660
UDYAM-699298,Tech Solutions Pvt tLd,ETBWM5611O,"plot 506, ph 1, electronic city, pune, mh",9977752992
UDYAM-532300,Dynamic Enterprises Limited,JQCKK5121O,"plot 802, ph 1, electronic city, hyderabad, ts",9263396656
UDYAM-810798,Metro Industries LLP,SUJGY7281E,"plot 892, okhla ind est, hyderabad, ts",9917249467
UDYAM-308756,Sunrsie Corp Limited,OZDYJ4408G,"Plot 703, Hitec City, Hyderabad, TS",9499876682
UDYAM-278791,Global Corp LLP,QEUWP7738Z,"plot 366, okhla ind est, hyderabad, ts",9861338993
UDYAM-994705,Prmie Ventures LLP,MHGKK0033W,"plot 544, hitec city, hyderabad, ts",9202295384
UDYAM-180567,Stellar Ventuers Pvt Ltd,BQFNG8127U,"Plot 826, Phase 1, Electronic City, Delhi, DL",9428468494
UDYAM-25598,Sunrise nIdustries LLP,SCJAW4862K,"Plot 348, MIDC, Bengaluru, KA",9882750322
UDYAM-881392,Stellar Indsutries Limited,OHDEQ7147F,"plot 678, peenya, chennai, tn",9993735394
UDYAM-510697,ApexS olutions Pvt Ltd,LOBTE3806Z,"Plot 46, Peenya, Mumbai, MH",9839908566
UDYAM-942613,Om Enterprises Pvt Ltd,LCUHY0112Y,"Plot 853, Phase 1, Electronic City, Ahmedabad, GJ",9839145434
UDYAM-393422,Global Logistics Pv tLtd,UHAEZ2904I,"plot 354, midc, pune, mh",9678025584
UDYAM-931345,Baalji Logistics Limited,OFJMA4119V,"plot 816, ph 1, electronic city, ahmedabad, gj",9155740531
UDYAM-990478,Apex Technologies Limited,OTLNN8980G,"plot 212, gidc, chennai, tn",9926991786
UDYAM-400174,Apex Corp LPL,PEGGH9026V,"Plot 545, Hitec City, Pune, MH",9712109672
UDYAM-162752,Sunrsie Traders LLP,VSBML2068Q,"Plot 732, Phase 1, Electronic City, Chennai, TN",9380581425
UDYAM-911213,Prime Industries Pvt Ltd,PPCKU6017S,"Plot 209, Guindy, Hyderabad, TS",9441838081
UDYAM-389695,Pioneer Technologies LLP,OZVUQ8168N,"plot 777, peenya, ahmedabad, gj",9984607500
UDYAM-700427,Tech Enterprises Pvt Ltd,EQGND8022G,"plot 417, peenya, pune, mh",9960977684
UDYAM-618776,Shree Technologies Limited,SYVTG8270Z,"plot 568, guindy, delhi, dl",9654842722
UDYAM-572096,Acme Enterprises Pvt Ltd,XAZVN7315C,"plot 491, midc, hyderabad, ts",9623256510
UDYAM-965854,Prime Vnetures Pvt Ltd,YHCTH0856N,"Plot 934, GIDC, Delhi, DL",9840054562
UDYAM-565592,Sunrise Enterprises LLP,NCRQU3638T,"Plot 161, Hitec City, Hyderabad, TS",9644099762
UDYAM-514027,Shree SolutionsP vt Ltd,ADVCR4801Q,"plot 662, guindy, chennai, tn",9728455384
UDYAM-356473,Dynamic Industrise Pvt Ltd,PODYD8886C,"Plot 565, Okhla Ind Estate, Ahmedabad, GJ",9865819074
UDYAM-352547,Shree Corp Pvt Ltd,BOETM9196B,"Plot 922, Hitec City, Chennai, TN",9121752149
UDYAM-325102,Shree Traders LLP,FHRCD7556A,"Plot 690, MIDC, Bengaluru, KA",9997133401
UDYAM-268277,Metro Traders Limited,LBHXQ8311B,"Plot 876, Phase 1, Electronic City, Pune, MH",9623489628
UDYAM-176431,Prime Ventures LLP,WKGWX6839H,"Gala No. 5, Shady Complex, Pune, MH",800207285
UDYAM-896567,Shree Crop Pvt Ltd,ZLIHP7671W,"plot 44, hitec city, mumbai, mh",9837549508
UDYAM-666152,Apex Traders Limited,KZMZI9696M,"Plot 336, MIDC, Bengaluru, KA",9685720823
UDYAM-779748,Metro Traders Limited,MNAQT4829F,"Plot 616, GIDC, Chennai, TN",9771105292
UDYAM-655045,Global Technologies Pvt Ltd,WQQEI6168G,"plot 555, peenya, pune, mh",9617910579
UDYAM-512915,Shree oLgistics LLP,LQPZZ8528G,"plot 43, ph 1, electronic city, ahmedabad, gj",9674688165
UDYAM-466272,Acem Traders Limited,MXRDB7726D,"Plot 852, Phase 1, Electronic City, Ahmedabad, GJ",9320024673
UDYAM-382212,Pioneer Fabrication LLP,ZVSHX0133J,"plot 815, ph 1, electronic city, hyderabad, ts",9658619955
UDYAM-796740,Stellar Solutinos Limited,MWTWA7935I,"plot 593, gidc, delhi, dl",9734044490
UDYAM-909021,Acme Traders Pvt Ltd,ZMXIT0549Q,"plot 354, guindy, mumbai, mh",9743495663
UDYAM-465497,Balaji Industries Pvt Ltd,ZFHMJ8485Y,"Plot 206, Guindy, Chennai, TN",9108055355
UDYAM-226311,Stlelar Solutions Pvt Ltd,GRZZA5254H,"Plot 151, Peenya, Mumbai, MH",9621223887
UDYAM-726303,Baalji Traders LLP,XIXJZ9122G,"plot 450, midc, bengaluru, ka",9242611727
UDYAM-560819,Acme Traders Pvt Ltd,VEQUZ3773Y,"gala no. 16, shady complex, hyderabad, ts",800235888
UDYAM-504950,Sunrise Logistics Pvt Ltd,EUGIB1077A,"Plot 595, GIDC, Pune, MH",9319831589
UDYAM-564462,Sunrise Logistics Limited,IUBRT0486I,"Plot 189, Hitec City, Bengaluru, KA",9771509860
UDYAM-827652,Metro oSlutions Limited,AVTKG1890N,"plot 250, ph 1, electronic city, hyderabad, ts",9491142529
UDYAM-644961,OmC orp LLP,AKNPY6090K,"plot 471, midc, bengaluru, ka",9877563763
UDYAM-849078,Om Industries Limited,CTYGO1893K,"Plot 212, Okhla Ind Estate, Mumbai, MH",9644114441
UDYAM-934303,Sunrise Traders Limited,DYAQM6580N,"plot 973, ph 1, electronic city, pune, mh",9913336961
UDYAM-706712,Global Technologies LLP,IXUZJ0931A,"Plot 291, Phase 1, Electronic City, Pune, MH",9227318614
UDYAM-289416,Shere Solutions Pvt Ltd,JKCKV0271Z,"plot 559, midc, pune, mh",9449183255
UDYAM-745308,Pioneer Vnetures Pvt Ltd,YLXOR2583Q,"plot 482, guindy, mumbai, mh",9447889777
UDYAM-127758,Metro Solutions Pvt Ltd,TMPPR4087C,"Plot 690, Peenya, Ahmedabad, GJ",9937439531
UDYAM-25361,Prime Enterprises LLP,JYRCP9455W,"plot 923, guindy, mumbai, mh",9558142894
UDYAM-975825,Acme Enterprises Pvt Ltd,SVKSZ3057P,"plot 70, hitec city, chennai, tn",9979872565
UDYAM-923771,Global Fabrication LLP,NFEDS3510P,"Plot 1, MIDC, Delhi, DL",9969121029
UDYAM-736111,Om Lgoistics LLP,HHGRU4922K,"Plot 172, Phase 1, Electronic City, Ahmedabad, GJ",9228227797
UDYAM-375865,Global Soultions LLP,NSHQB9937C,"plot 28, gidc, chennai, tn",9740158899
UDYAM-291455,Pioneer Traders Pvt Ltd,UQIEU9392I,"plot 847, midc, mumbai, mh",9620862069
UDYAM-109166,AcmeI ndustries Limited,DVGLQ7156R,"Plot 600, Hitec City, Pune, MH",9465216619
UDYAM-193282,Baljai Traders Pvt Ltd,CITZR6112P,"plot 9, guindy, delhi, dl",9871610453
UDYAM-749612,Dynamic Traders Limited,AEFVV2128N,"Plot 586, Peenya, Pune, MH",9672666376
UDYAM-412039,Sunrise Fabricatoin Limited,ELXLM6062E,"plot 890, peenya, mumbai, mh",9374688741
UDYAM-651768,Tech Enterprises LLP,JOZHD5389C,"Plot 641, Hitec City, Mumbai, MH",9664422866
UDYAM-606725,Tech Enterprises Pvt Ltd,JUTQH4964E,"plot 288, hitec city, ahmedabad, gj",9713125666
UDYAM-700561,Global Industires Pvt Ltd,PZFVN1874O,"plot 755, hitec city, delhi, dl",9492058984
UDYAM-655633,Tech Traders Pvt Ltd,DNWPX2951W,"Plot 407, Peenya, Mumbai, MH",9953753519
UDYAM-846714,Acme Ventures Pvt Ltd,KHEXB6861Z,"Plot 403, Okhla Ind Estate, Delhi, DL",9993747865
UDYAM-751993,Baljai Enterprises LLP,PUDOA6572W,"plot 416, okhla ind est, bengaluru, ka",9316392933
UDYAM-964275,Om Corp Limited,WNZBX1141J,"plot 961, ph 1, electronic city, hyderabad, ts",9536567221
UDYAM-34066,Sunrise Solutions LLP,QVDGF7358M,"plot 348, guindy, mumbai, mh",9990589496
UDYAM-869712,Sunrise Industrise Limited,PBTAN1829C,"plot 632, ph 1, electronic city, hyderabad, ts",9507331111
UDYAM-761129,Global CorpL imited,MKCHA3280O,"Plot 690, Guindy, Ahmedabad, GJ",9893222398
UDYAM-788205,Apex Solutions Pvt Ltd,BXVXZ7873Q,"Plot 161, GIDC, Mumbai, MH",9732053557
UDYAM-205795,Balaji Trdaers LLP,LSYKU4204Z,"Plot 420, MIDC, Chennai, TN",9119934935
UDYAM-81844,Sunris eTraders LLP,TZCYN1658J,"Plot 620, Hitec City, Delhi, DL",9838638447
UDYAM-907624,Tehc Enterprises LLP,LDTVB2243N,"Plot 971, Hitec City, Bengaluru, KA",9131574684
UDYAM-202087,Pioneer Enterprisse LLP,BDSZT7028L,"Plot 412, Phase 1, Electronic City, Ahmedabad, GJ",9625043395
UDYAM-810250,Sunrise Technologies LLP,SZBPR5523K,"Plot 176, Guindy, Hyderabad, TS",9577237750
UDYAM-394642,Prime Logistics Pvt Ltd,KQXFQ1300O,"plot 176, midc, pune, mh",9622175387
UDYAM-224848,Balaji Industries Lmiited,PYRGC5468M,"Plot 949, Peenya, Pune, MH",9319655493
UDYAM-362181,Tech Logistics Limited,KNUTX0163Y,"plot 718, midc, pune, mh",9487698999
UDYAM-482597,Balaji Solutions Ptv Ltd,EVISA7112V,"Plot 200, Okhla Ind Estate, Ahmedabad, GJ",9123211981
UDYAM-790893,Acme Logistics Pvt Ldt,KBZXK6076J,"plot 625, okhla ind est, pune, mh",9734718067
UDYAM-262536,Acme Industries Lmiited,GQKBT9397J,"plot 397, midc, hyderabad, ts",9975990126
UDYAM-858999,Shree Solutions Limited,RGPLT7882U,"plot 332, hitec city, mumbai, mh",9653264031
UDYAM-500235,Apex Fabrication LLP,LMQOA3385X,"Plot 195, MIDC, Hyderabad, TS",9445042185
UDYAM-652953,Global Industries LLP,IFOFX4129H,"plot 495, midc, delhi, dl",9757038438
UDYAM-644515,Acme Enterprises Limietd,KRMBA2216F,"Plot 418, MIDC, Delhi, DL",9540552148
UDYAM-104894,Poineer Industries LLP,JWFVL3234Y,"plot 903, midc, delhi, dl",9578383978
UDYAM-577933,Prime Ventures Limited,ACOED8562K,"plot 981, ph 1, electronic city, chennai, tn",9710772429
UDYAM-939287,Pioneer Industries Limited,NHMHE3668U,"Plot 659, Hitec City, Bengaluru, KA",9308789025
UDYAM-98019,Acme Technologeis Limited,TKJLV1113V,"plot 341, peenya, bengaluru, ka",9565637713
UDYAM-531440,Stellar Technologise LLP,DZNMM1373X,"plot 933, peenya, bengaluru, ka",9100995408
UDYAM-695201,Global Corp Limited,HLMEF9682B,"Plot 910, Phase 1, Electronic City, Chennai, TN",9625842815
UDYAM-333406,Stellar Ventures Pvt Ltd,HNCUZ8275G,"plot 433, okhla ind est, ahmedabad, gj",9201199482
UDYAM-986277,Balaji Tarders LLP,FWZDR0433B,"Plot 936, GIDC, Bengaluru, KA",9315313420
UDYAM-402291,Om Industries LLP,QHYIS2985B,"plot 581, peenya, ahmedabad, gj",9993189065
UDYAM-671568,Om Corp LLP,PEGSZ5779I,"Plot 249, Peenya, Ahmedabad, GJ",9991277518
UDYAM-406904,Om Enterprises Pvt Ltd,SBSPD0947O,"plot 694, guindy, bengaluru, ka",9555232744
UDYAM-249445,Global Solutions LLP,EXBZM7252N,"Plot 680, Peenya, Hyderabad, TS",9316314736
UDYAM-112257,Pioneer Logistics Limited,HIOGC6514B,"Plot 629, Okhla Ind Estate, Pune, MH",9289053417
UDYAM-505650,Om Technologeis Pvt Ltd,CSMDB0476X,"Plot 236, GIDC, Chennai, TN",9376479293
UDYAM-826862,Acme Corp Pvt Ltd,LACXF2231Y,"Plot 109, Hitec City, Pune, MH",9279987685
UDYAM-214226,Tehc Fabrication Pvt Ltd,VPYBK1986V,"plot 543, ph 1, electronic city, delhi, dl",9670549939
UDYAM-80019,Pioneer Corp Pv tLtd,UUUBB3322O,"Plot 747, Peenya, Bengaluru, KA",9496060423
UDYAM-770653,Sunrise Tradres Limited,OSAYR9727Z,"plot 412, ph 1, electronic city, hyderabad, ts",9806169287
UDYAM-136662,Dynamic Corp Pv tLtd,PAIQU2006T,"Plot 330, Guindy, Pune, MH",9566759486
UDYAM-509231,Acm eCorp Limited,SSBGL7728E,"plot 631, peenya, bengaluru, ka",9253124838
UDYAM-343158,Shree Traders Limited,IKBTS8856K,"plot 214, hitec city, hyderabad, ts",9985780115
UDYAM-898544,Shree Logistics Ptv Ltd,JRTNX4091G,"Plot 566, Peenya, Hyderabad, TS",9820455013
UDYAM-957615,Prime Fabrication Pvt Ltd,CYONV2421H,"plot 334, gidc, chennai, tn",9257206117
UDYAM-594347,Pioneer Fbarication Pvt Ltd,XXUBZ5707G,"Plot 429, Okhla Ind Estate, Ahmedabad, GJ",9789598958
UDYAM-444969,Tech Fabrication LLP,CPVRI7135V,"plot 841, peenya, delhi, dl",9572073896
UDYAM-130892,Acme Industrise LLP,DUKPK0182N,"plot 691, okhla ind est, chennai, tn",9200680749
UDYAM-725414,Sunrise Logistics Limited,JQXAK3959C,"plot 271, peenya, chennai, tn",9854363971
UDYAM-861653,Metro Solutions Limited,OMVWK7335O,"Plot 63, Phase 1, Electronic City, Hyderabad, TS",9807175619
UDYAM-874004,Om Technologeis LLP,EKIMB9465M,"plot 32, ph 1, electronic city, mumbai, mh",9521704823
UDYAM-724772,Metro Industries LLP,YQWEQ3094S,"plot 453, okhla ind est, pune, mh",9408865469
UDYAM-840648,Global Solutions Limited,XRSHK3708I,"plot 973, gidc, bengaluru, ka",9566923153
UDYAM-795715,Metro Corp Pvt Ltd,VZKHC2590Q,"gala no. 32, shady complex, ahmedabad, gj",800962410
UDYAM-787382,Apex Traders Limited,YFYAP7358E,"plot 481, midc, delhi, dl",9499400364
UDYAM-698909,Stellar Technologies LLP,LEKWV1004Y,"Plot 868, Phase 1, Electronic City, Bengaluru, KA",9567629697
UDYAM-460021,Global Corp LLP,IJNPQ5908V,"plot 146, hitec city, bengaluru, ka",9337942982
UDYAM-406352,Pioneer Tehcnologies Limited,MDOOR4823E,"Gala No. 10, Shady Complex, Pune, MH",800416060
UDYAM-486952,Pioneer Technologies LLP,GBAUW0031L,"plot 465, okhla ind est, mumbai, mh",9297826749
UDYAM-118930,Pioneer Industrie sLimited,QVAQI8964S,"Plot 424, Guindy, Chennai, TN",9734392929
UDYAM-588554,Shree Crop LLP,NJRWH8286S,"plot 902, gidc, delhi, dl",9682492430
UDYAM-594035,Dynamic Solutions Limited,FDHKQ7883G,"plot 744, okhla ind est, hyderabad, ts",9869201039
UDYAM-585044,Metro Technoolgies Pvt Ltd,HELTM3002T,"Plot 204, GIDC, Hyderabad, TS",9430023831
UDYAM-304315,Globa lLogistics Limited,ZWIMI9972O,"plot 148, ph 1, electronic city, mumbai, mh",9273883499
UDYAM-264042,Stellar Corp Limited,HDEIN8249H,"gala no. 40, shady complex, hyderabad, ts",800918438
UDYAM-185748,Dynamic Industries LLP,UIWXZ2105N,"plot 25, okhla ind est, ahmedabad, gj",9936048104
UDYAM-608538,Stellar Copr LLP,IBWUO5742V,"plot 223, peenya, bengaluru, ka",9298552670
UDYAM-90492,Apex Fabricaiton Limited,OZYWA3071Z,"plot 834, peenya, hyderabad, ts",9341294630
UDYAM-511839,Shree Traders LLP,HBEBK5599V,"Plot 497, Hitec City, Mumbai, MH",9549004012
UDYAM-950456,Apex Fabrication Limited,HLHYV8796C,"Plot 272, Hitec City, Pune, MH",9582292663
UDYAM-974079,Apxe Corp LLP,DAXFN0860Z,"Plot 732, MIDC, Delhi, DL",9220495166
UDYAM-64990,Shree Industreis LLP,NJWBN6316G,"plot 888, guindy, hyderabad, ts",9532320313
UDYAM-493107,Om Logistics Pvt Ltd,MZRSA4176F,"Plot 107, MIDC, Chennai, TN",9189013794
UDYAM-351316,Blaaji Technologies LLP,RZBGV3493P,"gala no. 74, shady complex, bengaluru, ka",800516826
UDYAM-169326,Sunrise Crop Limited,YRZMR4281B,"plot 556, gidc, ahmedabad, gj",9756245262
UDYAM-314389,Shree CorpP vt Ltd,XDDWR2303O,"plot 691, guindy, mumbai, mh",9843063058
UDYAM-925983,Sunrise Technologies Limited,WBURF1437O,"Plot 911, Phase 1, Electronic City, Bengaluru, KA",9953771901
UDYAM-246218,Stellar Trdaers Limited,MCUFL3628O,"plot 714, midc, mumbai, mh",9326323744
UDYAM-317782,Prime Ventures LLP,ZMKWO2089U,"plot 222, gidc, delhi, dl",9745114661
UDYAM-12498,Dynamic Enterprises Pvt Ltd,MJFKF9381Z,"Plot 168, Hitec City, Pune, MH",9146595047
UDYAM-21616,Balaji Solutions Limited,BIRBG5171S,"Plot 834, Guindy, Hyderabad, TS",9545028612
UDYAM-299285,Global Technologies Lmiited,SKJGN2345L,"Plot 770, Guindy, Pune, MH",9216405179
UDYAM-526230,TechT echnologies LLP,ZEIAT8870Q,"plot 431, hitec city, delhi, dl",9310281298
UDYAM-720940,Pionee rFabrication Limited,DRTWL0967Z,"Plot 179, MIDC, Chennai, TN",9744623260
UDYAM-250385,Balaji Fabrication Limited,ILITX7483S,"Gala No. 74, Shady Complex, Bengaluru, KA",800516826
UDYAM-980252,Prime Logistics Pvt Ltd,RSVMQ3280E,"Plot 134, GIDC, Delhi, DL",9950436696
UDYAM-507584,Om Industries Pvt Ltd,GCUHJ4718C,"plot 79, midc, mumbai, mh",9405391061
UDYAM-252151,Balaji Enterrpises Pvt Ltd,XPOKR8488J,"Plot 919, MIDC, Bengaluru, KA",9603919990
UDYAM-70626,Glboal Ventures Limited,VKMMG6919C,"Plot 758, MIDC, Hyderabad, TS",9374831455
UDYAM-821845,Pioneer Ventures LLP,GVRRZ5699G,"Plot 485, Peenya, Mumbai, MH",9760235770
UDYAM-974031,Om Industries LLP,UXTBD5971O,"plot 454, hitec city, bengaluru, ka",9697409824
UDYAM-898137,Apex Corp LLP,MFBKM8723Z,"Plot 546, Peenya, Ahmedabad, GJ",9688920952
UDYAM-892832,Stellar Industries Pvt Ltd,XZQOV0051N,"Plot 962, Peenya, Chennai, TN",9319691467
UDYAM-872580,Balaji Inudstries Pvt Ltd,PCJMQ1278U,"Plot 9, MIDC, Bengaluru, KA",9742622096
UDYAM-918679,Dynamic Soultions Limited,MVGDB4349C,"Plot 708, Okhla Ind Estate, Delhi, DL",9121954824
UDYAM-98040,Shree Solutions Pvt Ltd,UCCEI2901N,"plot 959, gidc, delhi, dl",9178641003
UDYAM-287377,Priem Corp LLP,TSDJI8895Y,"gala no. 61, shady complex, pune, mh",800942817
UDYAM-620055,Shree Logistics LLP,KDDWY3334F,"plot 994, ph 1, electronic city, ahmedabad, gj",9965980515
UDYAM-403194,Sunrise Traders Pvt Ltd,DZNJJ2348D,"Plot 300, Hitec City, Bengaluru, KA",9337269285
UDYAM-879199,Balaji Traders Pvt Ltd,NAUEV1186I,"plot 34, hitec city, chennai, tn",9862366732
UDYAM-690884,Tech Corp Limited,GFUOQ4718N,"Plot 837, MIDC, Bengaluru, KA",9732346706
UDYAM-883609,Global Venture sLLP,UTBFU8586B,"Plot 693, Okhla Ind Estate, Chennai, TN",9919452361
UDYAM-117376,Pioneer Traders Pvt Ltd,JGEMH8490P,"Plot 142, Hitec City, Pune, MH",9682239581
UDYAM-734324,Baalji Corp Limited,PUJKJ1463S,"Plot 897, Hitec City, Bengaluru, KA",9546233447
UDYAM-613893,Tech Logistics LLP,OSTRI0995C,"Plot 568, MIDC, Pune, MH",9777617658
UDYAM-239301,Balaji Technologies LLP,KHMJP2784Y,"Plot 926, Okhla Ind Estate, Chennai, TN",9895669575
UDYAM-607169,Priem Technologies Pvt Ltd,VGIDJ9963O,"Plot 412, MIDC, Mumbai, MH",9428932846
UDYAM-948139,Pioneer Solutions Pvt Ltd,XEBLM1188U,"Plot 801, MIDC, Ahmedabad, GJ",9630021309
UDYAM-187819,Dynamic Ventures Limited,YXQOI8941K,"plot 89, gidc, mumbai, mh",9887975137
UDYAM-614988,Dynamic Enterprises LLP,VWHEX8667S,"Plot 187, MIDC, Ahmedabad, GJ",9415661941
UDYAM-804438,Om Technologies Limited,WVYLM6967M,"plot 806, okhla ind est, hyderabad, ts",9625661267
UDYAM-270010,Metro Traders Pvt Ltd,MZIBX7907N,"Plot 275, Peenya, Hyderabad, TS",9502375494
UDYAM-960557,Balaji Ventures Pvt Ltd,HNAQW8369T,"plot 923, guindy, bengaluru, ka",9783854596
UDYAM-921925,Acme Industries Pvt Ltd,HZCER2415K,"Plot 314, Phase 1, Electronic City, Hyderabad, TS",9509516101
UDYAM-100074,Prime Ventures Limited,TTLWP2808Z,"Plot 982, Guindy, Hyderabad, TS",9843782177
UDYAM-194287,Apex Enterprises Pvt Ltd,GRERM2628N,"plot 915, gidc, ahmedabad, gj",9326212197
UDYAM-590452,Sunrise Logistics LLP,RHXCT1474T,"Plot 758, Guindy, Ahmedabad, GJ",9413346124
UDYAM-391002,Acme Fabrication LLP,CCDNM6309G,"Plot 453, Guindy, Hyderabad, TS",9358553615
UDYAM-646236,Apex Ventures Limited,HIAVN6522S,"Plot 57, Peenya, Mumbai, MH",9642196508
UDYAM-702600,Global Fabrication Limited,DOELQ5458V,"plot 682, midc, ahmedabad, gj",9238253528
UDYAM-207118,Pioneer Traders Pvt Ltd,DSZHN7601R,"plot 59, guindy, bengaluru, ka",9982110292
UDYAM-391636,SunriseT echnologies Pvt Ltd,ZWXID8765L,"plot 954, okhla ind est, chennai, tn",9457421627
UDYAM-991176,Om Fabrication LLP,QDBAB0948X,"Plot 529, Hitec City, Chennai, TN",9602698421
UDYAM-467997,Metro Technologies Pvt Ltd,GPWIF9727M,"plot 963, okhla ind est, hyderabad, ts",9378427943
UDYAM-962951,Prime Logsitics Limited,GPYPZ2703I,"Plot 993, MIDC, Pune, MH",9240739810
UDYAM-332095,Balaji Enterprises Pvt Ltd,QOUXP2758O,"Plot 268, Peenya, Hyderabad, TS",9983865811
UDYAM-802331,AcmeC orp Pvt Ltd,UTWLV5333D,"Plot 789, MIDC, Hyderabad, TS",9492982390
UDYAM-437910,Tech Tecnhologies Pvt Ltd,YXQFB2848I,"Plot 713, MIDC, Chennai, TN",9798295736
UDYAM-295682,Pioneer Fabrication Limited,LSOIG1906P,"Plot 403, Peenya, Bengaluru, KA",9487571583
UDYAM-232156,Global Vetnures Pvt Ltd,DKFLQ5188T,"Plot 723, Peenya, Mumbai, MH",9295429501
UDYAM-360668,Global Ventures LLP,RIOBJ8482W,"plot 313, peenya, chennai, tn",9395973879
UDYAM-911773,Shree Industries Limited,AALVS9740S,"Plot 785, GIDC, Mumbai, MH",9675362288
UDYAM-956933,Dynamic Enterprises Limited,RZVBS1387T,"plot 743, gidc, hyderabad, ts",9843146463
UDYAM-579062,Shree Fabrication LLP,ZNOCM6299T,"Plot 311, GIDC, Chennai, TN",9823018551
UDYAM-124770,Mtero Traders Pvt Ltd,HBSLI4301I,"plot 927, hitec city, mumbai, mh",9581544726
UDYAM-457523,Om Industries vPt Ltd,OJHWP4827F,"Plot 647, Peenya, Ahmedabad, GJ",9939928916
UDYAM-103090,Sunrise Technologies Pvt Ltd,IHICE8590E,"plot 444, okhla ind est, ahmedabad, gj",9957146976
UDYAM-812254,Prime Venturse LLP,ZDYYY7858F,"Plot 979, GIDC, Chennai, TN",9124734265
UDYAM-946087,Acme Traders Limtied,OZCZV2367Q,"Plot 413, Phase 1, Electronic City, Chennai, TN",9471725914
UDYAM-827232,Tech Traders Limited,ERWKZ6654B,"gala no. 61, shady complex, pune, mh",800942817
UDYAM-138426,Sunrise Venturse Pvt Ltd,SMLTH8651T,"Plot 314, Peenya, Ahmedabad, GJ",9576404415
UDYAM-134829,Acme Solutions LLP,SYBNY9331K,"plot 739, midc, ahmedabad, gj",9190668669
UDYAM-286308,Metro Logistics LLP,OXHFC3589A,"Plot 654, Guindy, Chennai, TN",9476739284
UDYAM-486993,Pioneer Logistics Limited,HNOLW4580D,"Plot 203, Okhla Ind Estate, Ahmedabad, GJ",9743099620
UDYAM-778661,Tech Enterprises Pvt Ltd,DIATS3516P,"Plot 728, MIDC, Chennai, TN",9886676599
UDYAM-884185,Amce Fabrication Limited,VHDNN8247B,"plot 392, guindy, mumbai, mh",9440570025
UDYAM-987764,Tech Industries Pvt Ltd,KYXHY3593S,"Plot 955, GIDC, Chennai, TN",9651189395
UDYAM-568648,Om Fabrication Pvt tLd,XXFRJ7267R,"Plot 113, Okhla Ind Estate, Ahmedabad, GJ",9247043048
UDYAM-370032,Global Fabrication LLP,FCMKP0586Z,"plot 484, gidc, chennai, tn",9825212990
UDYAM-58980,DynamicE nterprises Pvt Ltd,YRESS4753A,"Plot 350, Guindy, Chennai, TN",9818475823
UDYAM-275660,Sunrise Technologies Limited,IYQYX3955L,"Plot 51, Okhla Ind Estate, Chennai, TN",9689277965
UDYAM-39736,Pioneer Traders Pvt Ltd,MXBWO9079J,"plot 529, okhla ind est, ahmedabad, gj",9449759484
UDYAM-87901,Om Corp Pvt Ltd,JXRYO7781H,"Plot 507, Guindy, Hyderabad, TS",9375878015
UDYAM-946929,Prime Industries Pvt Ltd,WIZEC9299W,"Plot 501, Guindy, Pune, MH",9202283379
UDYAM-933527,Sunrise Corp LLP,EBAKQ4255O,"Plot 630, Okhla Ind Estate, Pune, MH",9187751103
UDYAM-286143,Apex Technoolgies LLP,JRAEC4498C,"Plot 61, MIDC, Delhi, DL",9688375559
UDYAM-873874,Tech Industries Pvt Ltd,PMCSV4973E,"plot 712, ph 1, electronic city, pune, mh",9185723409
UDYAM-917017,Sunrise Solutions Limited,FYGCK9324I,"Plot 403, GIDC, Chennai, TN",9715470145
UDYAM-879981,Dnyamic Solutions Limited,LZWXF4856N,"plot 194, gidc, delhi, dl",9881315569
UDYAM-120461,Shree Industrie sPvt Ltd,VUQIS7555W,"plot 900, guindy, hyderabad, ts",9897152927
UDYAM-658729,O mTraders Limited,BKOHP4267V,"Plot 77, Okhla Ind Estate, Ahmedabad, GJ",9619639012
UDYAM-723571,Shree Fabrication Limited,WXLKC9196H,"plot 82, midc, hyderabad, ts",9935252692
UDYAM-670120,Pioneer Solutions Pvt Ltd,RTSNS1896L,"plot 909, ph 1, electronic city, chennai, tn",9866419756
UDYAM-494462,Prime Industries Limietd,ETFJR0263X,"plot 207, gidc, mumbai, mh",9591680444
UDYAM-505773,Balaji Enterprises Pv tLtd,DYJVT1356Z,"Plot 666, MIDC, Delhi, DL",9568137248
UDYAM-255092,Tech Technologies Limited,QLTZE4318I,"Plot 360, Phase 1, Electronic City, Delhi, DL",9527017329
UDYAM-398470,Sunrise Soultions LLP,XNEMZ7977H,"Plot 201, MIDC, Pune, MH",9981623566
UDYAM-417938,Global Solutions Pvt Ltd,IYEXK3887D,"plot 41, hitec city, chennai, tn",9614225733
UDYAM-723596,Sunrise Solutions LLP,IGLPN8438N,"Plot 867, Okhla Ind Estate, Ahmedabad, GJ",9334541550
UDYAM-807610,Stellar Enterprisse LLP,WEHRQ7429S,"Plot 874, GIDC, Chennai, TN",9751633160
UDYAM-716148,Prim eCorp LLP,GQKMI0451O,"plot 336, hitec city, chennai, tn",9411059541
UDYAM-555729,Tech Industries Limtied,FQPMF2345V,"plot 316, ph 1, electronic city, chennai, tn",9754075137
UDYAM-839568,Stellar Traders LLP,JQLZK8111H,"Plot 420, Phase 1, Electronic City, Bengaluru, KA",9724074540
UDYAM-395456,Golbal Enterprises LLP,FSNJM7428L,"plot 992, okhla ind est, delhi, dl",9875991153
UDYAM-752125,Acme Fabrictaion Pvt Ltd,CSROY8049J,"Plot 440, Phase 1, Electronic City, Ahmedabad, GJ",9612130045
UDYAM-509938,Pinoeer Fabrication LLP,DPDYH7809N,"Plot 526, Guindy, Hyderabad, TS",9717113139
UDYAM-540844,Metro Fabrication Pvt Ltd,ADSNV6817V,"Plot 964, Peenya, Hyderabad, TS",9800470534
UDYAM-319406,Global SolutionsL LP,TIXRZ9620X,"Plot 68, Guindy, Hyderabad, TS",9378436789
UDYAM-332324,Shree Logistics Pvt Ltd,JHFPT4836S,"plot 310, ph 1, electronic city, delhi, dl",9817309606
UDYAM-243029,Shree Traders Limited,DPDIO7996K,"plot 290, guindy, hyderabad, ts",9343386457
